doc,question,ref
LAW_PDPA_2562.pdf,สิทธ์ของเจ้าข้อมูลส่วนบุคคลในกรณีที่ผู้ควบคุมข้อมูลปฏิเสธคำขอควรได้รับการบันทึกหรือไม่?,"การใช้สิทธิของเจ้าของข้อมูลส่วนบุคคลตามวรรคหนึ่งจะใช้กับการส่งหรือโอนข้อมูลส่วนบุคคล
ของผู้ควบคุมข้อมูลส่วนบุคคลซึ่งเป็นการปฏิบัติหน้าที่เพื่อประโยชน์สาธารณะหรือเป็นการปฏิบัติหน้าที่
ตามกฎหมายไม่ได้หรือการใช้สิทธินั้นต้องไม่ละเมิดสิทธิหรือเสรีภาพของบุคคลอื่น ทั้งนี้ ในกรณีที่ผู้ควบคุม
ข้อมูลส่วนบุคคลปฏิเสธคำขอด้วยเหตุผลดังกล่าว ให้ผู้ควบคุมข้อมูลส่วนบุคคลบันทึกการปฏิเสธคำขอ
พร้อมด้วยเหตุผลไว้ในรายการตามมาตรา ๓๙
มาตรา ๓๒ เจ้าของข้อมูลส่วนบุคคลมีสิทธิคัดค้านการเก็บรวบรวม ใช้หรือเปิดเผยข้อมูล
ส่วนบุคคลที่เกี่ยวกับตนเมื่อใดก็ได้ดังต่อไปนี้
(๑) กรณีที่เป็นข้อมูลส่วนบุคคลที่เก็บรวบรวมได้โดยได้รับยกเว้นไม่ต้องขอความยินยอม
ตามมาตรา ๒๔ (๔) หรือ (๕) เว้นแต่ผู้ควบคุมข้อมูลส่วนบุคคลพิสูจน์ได้ว่า"
LAW_PDPA_2562.pdf,คำถาม: การขอความยินยอมจากเจ้าของข้อมูลส่วนบุคคลจำเป็นหรือไม่ในกรณีที่ข้อมูลนั้นถูกใช้เพื่อวัตถุประสงค์ของการตลาดแบบตรง?,"(๑) กรณีที่เป็นข้อมูลส่วนบุคคลที่เก็บรวบรวมได้โดยได้รับยกเว้นไม่ต้องขอความยินยอม
ตามมาตรา ๒๔ (๔) หรือ (๕) เว้นแต่ผู้ควบคุมข้อมูลส่วนบุคคลพิสูจน์ได้ว่า
(ก) การเก็บรวบรวม ใช้หรือเปิดเผยข้อมูลส่วนบุคคลนั้น ผู้ควบคุ มข้อมูลส่วนบุคคล
ได้แสดงให้เห็นถึงเหตุอันชอบด้วยกฎหมายที่สำคัญยิ่งกว่า
(ข) การเก็บรวบรวม ใช้หรือเปิดเผยข้อมูลส่วนบุคคลนั้นเป็นไปเพื่อก่อตั้งสิทธิเรียกร้อง
ตามกฎหมาย การปฏิบัติตามหรือการใช้สิทธิเรียกร้องตามกฎหมาย หรือการยกขึ้นต่อสู้สิทธิเรียกร้อง
ตามกฎหมาย
(๒) กรณีที่เป็นการเก็บรวบรวม ใช้หรือเปิดเผยข้อมูลส่วนบุคคลเพื่อวัตถุประสงค์เกี่ยวกับ
การตลาดแบบตรง
(๓) กรณีที่เป็นการเก็บรวบรวม ใช้หรือเปิดเผยข้อมูลส่วนบุคคลเพื่อวัตถุประสงค์เกี่ยวกับ
การศึกษาวิจัยทางวิทยาศาสตร์ ประวัติศาสตร์ หรือสถิติ เว้นแต่เป็นการจำเป็นเพื่อการดำเนินภารกิจ"
LAW_PDPA_2562.pdf,นำข้อมูลส่วนบุคคลไปใช้วิจัยต้องปฏิบัติอย่างไร?,"(๓) กรณีที่เป็นการเก็บรวบรวม ใช้หรือเปิดเผยข้อมูลส่วนบุคคลเพื่อวัตถุประสงค์เกี่ยวกับ
การศึกษาวิจัยทางวิทยาศาสตร์ ประวัติศาสตร์ หรือสถิติ เว้นแต่เป็นการจำเป็นเพื่อการดำเนินภารกิจ
เพื่อประโยชน์สาธารณะของผู้ควบคุมข้อมูลส่วนบุคคล
ในกรณีที่เจ้าของข้อมูลส่วนบุคคลใช้สิทธิคัดค้านตามวรรคหนึ่ง ผู้ควบคุมข้อมูลส่วนบุคคล
ไม่สามารถเก็บรวบรวม ใช้หรือเปิดเผยข้อมูลส่วนบุคคลนั้นต่อไปได้ทั้งนี้ผู้ควบคุมข้อมูลส่วนบุคคล
ต้องปฏิบัติโดยแยกส่วนออกจากข้อมูลอื่นอย่างชัดเจนในทันทีเมื่อเจ้าของข้อมูลส่วนบุคคลได้แจ้ง
การคัดค้านให้ผู้ควบคุมข้อมูลส่วนบุคคลทราบ
ในกรณีที่ผู้ควบคุมข้อมูลส่วนบุคคลปฏิเสธการคัดด้านด้วยเหตุผลตาม (๑) (ก) หรือ (ข)
หรือ (๓) ให้ผู้ควบคุมข้อมูลส่วนบุคคลบันทึกการปฏิเสธการคัดค้านพร้อมด้วยเหตุผลไว้ในรายการ
ตามมาตรา ๓๙"
LAW_PDPA_2562.pdf,คำว่าผู้ควบคุมข้อมูลส่วนบุคคลบันทึกการปฏิเสธการคัดค้านพร้อมด้วยเหตุผลไว้ได้ที่หัวข้อไหน?,"ในกรณีที่ผู้ควบคุมข้อมูลส่วนบุคคลปฏิเสธการคัดด้านด้วยเหตุผลตาม (๑) (ก) หรือ (ข)
หรือ (๓) ให้ผู้ควบคุมข้อมูลส่วนบุคคลบันทึกการปฏิเสธการคัดค้านพร้อมด้วยเหตุผลไว้ในรายการ
ตามมาตรา ๓๙
มาตรา ๓๓ เจ้าของข้อมูลส่วนบุคคลมีสิทธิขอให้ผู้ควบคุมข้อมูลส่วนบุคคลดำเนินการลบ
หรือทำลาย หรือทำให้ข้อมูลส่วนบุคคลเป็นข้อมูลที่ไม่สามารถระบุตัวบุคคลที่เป็นเจ้าของข้อมูล
ส่วนบุคคลได้ ในกรณีดังต่อไปนี้หน้า ๖๙
เล่ม ๑๓๖ ตอนที่ ๖๙ ก ราชกิจจานุเบกษา ๒๗ พฤษภาคม ๒๕๖๒"
LAW_PDPA_2562.pdf,คำถามสำคัญ: คุณทราบหรือไม่ว่าการคุ้มครองข้อมูลส่วนบุคคลเป็นสิทธิพื้นฐานของประชาชนในกรอบกฎหมาย? ,"(๑) เมื่อข้อมูลส่วนบุคคลหมดความจำเป็นในการเก็บรักษาไว้ตามวัตถุประสงค์ในการเก็บรวบรวม
ใช้หรือเปิดเผยข้อมูลส่วนบุคคล
(๒) เมื่อเจ้าของข้อมูลส่วนบุคคลถอนความยินยอมในการเก็บรวบรวม ใช้หรือเปิดเผยข้อมูล
ส่วนบุคคลและผู้ควบคุมข้อมูลส่วนบุคคลไม่มีอำนาจตามกฎหมายที่จะเก็บรวบรวม ใช้หรือเปิดเผยข้อมูล
ส่วนบุคคลนั้นได้ต่อไป
(๓) เมื่อเจ้าของข้อมูลส่วนบุคคลคัดค้านการเก็บรวบรวม ใช้หรือเปิดเผยข้อมูลส่วนบุคคล
ตามมาตรา ๓๒ (๑) และผู้ควบคุมข้อมูลส่วนบุคคลไม่อาจปฏิเสธคำขอตามมาตรา ๓๒ (๑) (ก)
หรือ (ข) ได้หรือเป็นการคัดค้านตามมาตรา ๓๒ (๒)
(๔) เมื่อข้อมูลส่วนบุคคลได้ถูกเก็บรวบรวม ใช้หรือเปิดเผยโดยไม่ชอบด้วยกฎหมายตามที่
กำหนดไว้ในหมวดนี้
ความในวรรคหนึ่งมิให้นำมาใช้บังคับกับการเก็บรักษาไว้เพื่อวัตถุประสงค์ในการใช้เสรีภาพ"
LAW_PDPA_2562.pdf,ข้อมูลส่วนบุคคลถูกเก็บรวบรวมไว้อย่างไร?,"(๔) เมื่อข้อมูลส่วนบุคคลได้ถูกเก็บรวบรวม ใช้หรือเปิดเผยโดยไม่ชอบด้วยกฎหมายตามที่
กำหนดไว้ในหมวดนี้
ความในวรรคหนึ่งมิให้นำมาใช้บังคับกับการเก็บรักษาไว้เพื่อวัตถุประสงค์ในการใช้เสรีภาพ
ในการแสดงความคิดเห็น การเก็บรักษาไว้เพื่อวัตถุประสงค์ตามมาตรา ๒๔ (๑) หรือ (๔) หรือ
มาตรา ๒๖ (๕) (ก) หรือ (ข) การใช้เพื่อการก่อตั้งสิทธิเรียกร้องตามกฎหมาย การปฏิบัติตามหรือ
การใช้สิทธิเรียกร้องตามกฎหมาย หรือการยกขึ้นต่อสู้สิทธิเรียก ร้องตามกฎหมาย หรือเพื่อการปฏิบัติ
ตามกฎหมาย
ในกรณีที่ผู้ควบคุมข้อมูลส่วนบุคคลได้ทำให้ข้อมูลส่วนบุคคลเป็นข้อมูลที่เปิดเผยต่อสาธารณะ
และผู้ควบคุมข้อมูลส่วนบุคคลถูกขอให้ลบหรือทำลายหรือทำให้ข้อมูลส่วนบุคคลเป็นข้อมูลที่ไม่สามารถ
ระบุตัวบุคคลที่เป็นเจ้าของข้อมูลส่วนบุคคลได้ตามวรรคหนึ่ง ผู้ควบคุมข้อมูลส่วนบุคคลต้องเป็น"
LAW_PDPA_2562.pdf,ผู้ควบคุมข้อมูลส่วนบุคคลต้องทำอย่างไรเมื่อถูกขอให้ลบข้อมูลส่วนบุคคล?,"และผู้ควบคุมข้อมูลส่วนบุคคลถูกขอให้ลบหรือทำลายหรือทำให้ข้อมูลส่วนบุคคลเป็นข้อมูลที่ไม่สามารถ
ระบุตัวบุคคลที่เป็นเจ้าของข้อมูลส่วนบุคคลได้ตามวรรคหนึ่ง ผู้ควบคุมข้อมูลส่วนบุคคลต้องเป็น
ผู้รับผิดชอบดำเนินการทั้งในทางเทคโนโลยีและค่าใช้จ่ายเพื่อให้เป็นไปตามคำขอนั้น โดยแจ้งผู้ควบคุม
ข้อมูลส่วนบุคคลอื่น ๆ เพื่อให้ได้รับคำตอบในการดำเนินการให้เป็นไปตามคำขอ
กรณีผู้ควบคุมข้อมูลส่วนบุคคลไม่ดำเนินการตามวรรคหนึ่งหรือวรรคสาม เจ้าของข้อมูลส่วนบุคคล
มีสิทธิร้องเรียนต่อคณะกรรมการผู้เชี่ยวชาญเพื่อสั่งให้ผู้ควบคุมข้อมูลส่วนบุคคลดำเนินการได้
คณะกรรมการอาจประกาศกำหนดหลักเกณฑ์ในการลบหรือทำลาย หรือทำให้ข้อมูลส่วนบุคคล
เป็นข้อมูลที่ไม่สามารถระบุตัวบุคคลที่เป็นเจ้าของข้อมูลส่วนบุคคลตามวรรคหนึ่งก็ได้
มาตรา ๓๔ เจ้าของข้อมูลส่วนบุคคลมีสิทธิขอให้ผู้ควบคุมข้อมูลส่วนบุคคลระงับการใช้"
LAW_PDPA_2562.pdf,ข้อข้องเท็จ สิทธิ์ขอให้ระงับการใช้ข้อมูลส่วนบุคคลอย่างไรในกรณีที่ผู้ควบคุมข้อมูลอยู่ระหว่างการตรวจสอบ?,"เป็นข้อมูลที่ไม่สามารถระบุตัวบุคคลที่เป็นเจ้าของข้อมูลส่วนบุคคลตามวรรคหนึ่งก็ได้
มาตรา ๓๔ เจ้าของข้อมูลส่วนบุคคลมีสิทธิขอให้ผู้ควบคุมข้อมูลส่วนบุคคลระงับการใช้
ข้อมูลส่วนบุคคลได้ ในกรณีดังต่อไปนี้
(๑) เมื่อผู้ควบคุมข้อมูลส่วนบุคคลอยู่ในระหว่างการตรวจสอบตามที่เจ้าของข้อมูลส่วนบุคคล
ร้องขอให้ดำเนินการตามมาตรา ๓๖ หน้า ๗๐
เล่ม ๑๓๖ ตอนที่ ๖๙ ก ราชกิจจานุเบกษา ๒๗ พฤษภาคม ๒๕๖๒"
LAW_PDPA_2562.pdf,คำว่าข้อมูลส่วนบุคคลหมายถึงอะไรบนบทความนี้?,"(๒) เมื่อเป็นข้อมูลส่วนบุคคลที่ต้องลบหรือทำลายตามมาตรา ๓๓ (๔) แต่เจ้าของข้อมูล
ส่วนบุคคลขอให้ระงับการใช้แทน
(๓) เมื่อข้อมูลส่วนบุคคลหมดความจำเป็นในการเก็บรักษาไว้ตามวัตถุประสงค์ในการเก็บรวบรวม
ข้อมูลส่วนบุคคล แต่เจ้าของข้อมูลส่วนบุคคลมีความจำเป็นต้องขอให้เก็บรักษาไว้เพื่อใช้ในการก่อตั้ง
สิทธิเรียกร้องตามกฎหมาย การปฏิบัติตามหรือการใช้สิทธิเรียกร้องตามกฎหมาย หรือการยกขึ้นต่อสู้
สิทธิเรียกร้องตามกฎหมาย
(๔) เมื่อผู้ควบคุมข้อมูลส่วนบุคคลอยู่ในระหว่าง การพิสูจน์ตามมาตรา ๓๒ (๑) หรือตรวจสอบ
ตามมาตรา ๓๒ (๓) เพื่อปฏิเสธการคัดค้านของเจ้าของข้อมูลส่วนบุคคลตามมาตรา ๓๒ วรรคสาม
กรณีผู้ควบคุมข้อมูลส่วนบุคคลไม่ดำเนินการตามวรรคหนึ่ง เจ้าของข้อมูลส่วนบุคคลมีสิทธิ
ร้องเรียนต่อคณะกรรมการผู้เชี่ยวชาญเพื่อสั่งให้ผู้ควบคุมข้อมูลส่วนบุคคลดำเนินการได้"
LAW_PDPA_2562.pdf,อ้างมาตราที่เกี่ยวข้องกับการร้องเรียนเกี่ยวกับข้อมูลส่วนบุคคลได้หรือไม่?,"กรณีผู้ควบคุมข้อมูลส่วนบุคคลไม่ดำเนินการตามวรรคหนึ่ง เจ้าของข้อมูลส่วนบุคคลมีสิทธิ
ร้องเรียนต่อคณะกรรมการผู้เชี่ยวชาญเพื่อสั่งให้ผู้ควบคุมข้อมูลส่วนบุคคลดำเนินการได้
คณะกรรมการอาจประกาศกำหนดหลักเกณฑ์ในการระงับการใช้ตามวรรคหนึ่งก็ได้
มาตรา ๓๕ ผู้ควบคุมข้อมูลส่วนบุคคลต้องดำเนินการให้ข้อมูลส่วนบุคคลนั้นถูกต้อง
เป็นปัจจุบัน สมบูรณ์ และไม่ก่อให้เกิดความเข้าใจผิด
มาตรา ๓๖ ในกรณีที่เจ้าของข้อมูลส่วนบุคคลร้องขอให้ผู้ควบคุมข้อมูลส่วนบุคคลดำเนินการ
ตามมาตรา ๓๕ หากผู้ควบคุมข้อมูลส่วนบุคคลไม่ดำเนินการตามคำร้องขอ ผู้ควบคุมข้อมูลส่วนบุคคล
ต้องบันทึกคำร้องขอของเจ้าของข้อมูลส่วนบุคคลพร้อมด้วยเหตุผลไว้ในรายการตามมาตรา ๓๙
ให้นำความในมาตรา ๓๔ วรรคสอง มาใช้บังคับโดยอนุโลม
มาตรา ๓๗ ผู้ควบคุมข้อมูลส่วนบุคคลมีหน้าที่ดังต่อไปนี้"
LAW_PDPA_2562.pdf,ข้อมูลส่วนบุคคลต้องมีมาตรการรักษาความมั่นคงปลอดภัยที่เหมาะสมเพื่อป้องกันการเปิดเผยหรือใช้ข้อมูลโดยไม่ชอบ ณ มาตราใด?,"ต้องบันทึกคำร้องขอของเจ้าของข้อมูลส่วนบุคคลพร้อมด้วยเหตุผลไว้ในรายการตามมาตรา ๓๙
ให้นำความในมาตรา ๓๔ วรรคสอง มาใช้บังคับโดยอนุโลม
มาตรา ๓๗ ผู้ควบคุมข้อมูลส่วนบุคคลมีหน้าที่ดังต่อไปนี้
(๑) จัดให้มีมาตรการรักษาความมั่นคงปลอดภัยที่เหมาะสม เพื่อป้องกันการสูญหาย เข้าถึง ใช้
เปลี่ยนแปลง แก้ไข หรือเปิดเผยข้อมูลส่วนบุคคลโดยปราศจากอำนาจหรือโดยมิชอบ และต้องทบทวน
มาตรการดังกล่าวเมื่อมีความจำเป็นหรือเมื่อเทคโนโลยีเปลี่ยนแปลงไปเพื่อให้มีประสิทธิภาพในการรักษา
ความมั่นคงปลอดภัยที่เหมาะสม ทั้งนี้ ให้เป็นไปตามมาตรฐานขั้นต่ำที่คณะกรร มการประกาศกำหนด
(๒) ในกรณีที่ต้องให้ข้อมูลส่วนบุคคลแก่บุคคลหรือนิติบุคคลอื่นที่ไม่ใช่ผู้ควบคุมข้อมูลส่วนบุคคล
ต้องดำเนินการเพื่อป้องกันมิให้ผู้นั้นใช้หรือเปิดเผยข้อมูลส่วนบุคคลโดยปราศจากอำนาจหรือโดยมิชอบ"
