doc,question,ref
general_news.txt,การติดตามข่าวทางกีฬาได้ที่ไหนบ้าง?,Talkกีฬาข่าวทั้งหมดฟุตบอลต่างประเทศฟุตบอลไทยSport Insiderไฟต์สปอร์ตกีฬาโลกวิดีโอแกลเลอรี่Thairath Shoppingช้อปปิ้งซื้อ-ขายส่วนลดThairath MoneyInvestmentPersonal Finance EconomicsBusiness & MarketingTech & InnovationSustainabilityExperts PoolVideosPR NewsThairath PlusPolitics & SocietyEveryday LifeSubcultureNature MatterMIRRORLIFEWELLNESSCULTUREBEAUTYVIDEOไทยรัฐ TVรายการทั้งหมดLiveดูย้อนหลังผังรายการFuture Perfectมูลนิธิไทยรัฐเกี่ยวกับมูลนิธิไทยรัฐ100ปีกำพล วัชรพลประวัติและผลงานข่าวสารกิจกรรมวิดีโอมูลนิธิไทยรัฐ ติดตามเราได้ที่ Facebook Instagram Youtube tiktok •ร่วมงานกับเรา•เกี่ยวกับเรา•ติดต่อโฆษณา•ติดต่อเรา
general_news.txt,ตำแหน่งใดที่จะเกษียณอายุมากที่สุดในสายงานประภททั่วไปในระยะ 10 ปี?,"21 มี.ค. 2567 14:34 น.ข่าวในกระแสไทยรัฐออนไลน์เช็กเลย เปิด 10 อันดับสายงานที่จะเกษียณอายุมากที่สุดในระยะ 10 ปี-กกก+LightDarkฟังข่าวแชร์ข่าวสำนักงานเลขาธิการสภาผู้แทนราษฎร เผยตำแหน่งในสายงาน (ประเภททั่วไป) ที่จะเกษียณอายุมากที่สุด 10 อันดับ ในระยะ 10 ปีมีตำแหน่งอะไรบ้าง เช็กได้เลยวันที่ 21 มีนาคม 2567 มีรายงานว่า แฟนเพจ
LIRT : คลังสารสนเทศของสถาบันนิติบัญญัติสำนักงานเลขาธิการสภาผู้แทนราษฎร ได้เผยตำแหน่งในสายงาน (ประเภททั่วไป) ที่จะเกษียณอายุมากที่สุด 10 อันดับ ในระยะ 10 ปี (พ.ศ. 2566-2575) ดังนี้1. เจ้าพนักงานธุรการ 4,499 คน2. เจ้าพนักงานสาธารณสุข 2,509 คน3. เจ้าพนักงานการเงินและบัญชี 2,036 คน4. นายช่างโยธา 1,833 คน5. เจ้าพนักงานป่าไม้ 1,476 คน6. เจ้าพนักงานสรรพากร 1,462 คน7. เจ้าพนักงานราชทัณฑ์ 1,350 คน8. นายช่างรังวัด 1,267 คน9. เจ้าพนักงานขนส่ง 1,213 คน10. เจ้าพนักงานทันตสาธารณสุข"
general_news.txt,คำถามสำคัญ: สถิติจำนวนคนในตำแหน่งที่รายงานมามีผลต่อการจัดแบ่งงบประมาณหรือการวางแผนหรือไม่?,"คน4. นายช่างโยธา 1,833 คน5. เจ้าพนักงานป่าไม้ 1,476 คน6. เจ้าพนักงานสรรพากร 1,462 คน7. เจ้าพนักงานราชทัณฑ์ 1,350 คน8. นายช่างรังวัด 1,267 คน9. เจ้าพนักงานขนส่ง 1,213 คน10. เจ้าพนักงานทันตสาธารณสุข 1,008 คน.ข้อมูลจาก แฟนเพจ
LIRT : คลังสารสนเทศของสถาบันนิติบัญญัติสำนักงานเลขาธิการสภาผู้แทนราษฎร,
กำลังคนภาครัฐ 2565 / สำนักงาน ก.พ......."
general_news.txt,สิ่งที่คุณก็ยอดเห็น แต่อาจจะไม่สามารถตอบได้คือ ว่าคุณสนใจเกี่ยวกับข่าวหรือเนื้อหาในสื่อออนไลน์?,Logo Thairathicon membericon searchข่าววิดีโอหนังสือพิมพ์ไทยรัฐทีวีไลฟ์สไตล์กีฬาบันเทิงดวงหวยนิยายช็อปปิ้งMONEYMIRRORTHAIRATH +LIVEข่าวข่าวทั้งหมดพระราชสำนักทั่วไทยในกระแสการเมืองเศรษฐกิจต่างประเทศอาชญากรรมยานยนต์เทคโนโลยีราคาทองคำรายงานพิเศษเกษตรความยั่งยืนคอลัมน์Refresh Storiesบันเทิงข่าวทั้งหมดข่าวบันเทิงดารา เซเลบกอสซิบนางงามละคร ซีรีย์เพลงหนังนิยายไลฟ์สไตล์ข่าวทั้งหมดสุขภาพและความงามไอทีไลฟ์สไตล์ 45+ท่องเที่ยวพระเครื่องประวัติบุคคลวิดีโอวิดีโอทั้งหมดคลิปเด่นThairath TalkสถานีผีดุคลับรถMoneyThairath PlusPeepzMIRRORPodcastหวยตรวจหวยตรวจหวยย้อนหลังสถิติหวยข่าวเลขเด็ดดวงดูดวงรายวันทำนายฝันดูดวงไพ่ยิปซีดูดวงความรักดูดวงราศีดูดวงนักษัตรดวงรายสัปดาห์ดวงรายเดือนดวงน่าอ่านวอลมงคลหนังสือพิมพ์หนังสือพิมพ์ล่าสุดคอลัมน์หนังสือพิมพ์หนังสือพิมพ์ย้อนหลังInfographicThairath
general_news.txt,ทางเว็บไซต์ Thairath นำเสนอเนื้อหาที่หลากหลาย เราสามารถค้นหาข่าวที่สนใจได้ด้วยคำค้นหลักอะไร?,Talkกีฬาข่าวทั้งหมดฟุตบอลต่างประเทศฟุตบอลไทยSport Insiderไฟต์สปอร์ตกีฬาโลกวิดีโอแกลเลอรี่Thairath Shoppingช้อปปิ้งซื้อ-ขายส่วนลดThairath MoneyInvestmentPersonal Finance EconomicsBusiness & MarketingTech & InnovationSustainabilityExperts PoolVideosPR NewsThairath PlusPolitics & SocietyEveryday LifeSubcultureNature MatterMIRRORLIFEWELLNESSCULTUREBEAUTYVIDEOไทยรัฐ TVรายการทั้งหมดLiveดูย้อนหลังผังรายการFuture Perfectมูลนิธิไทยรัฐเกี่ยวกับมูลนิธิไทยรัฐ100ปีกำพล วัชรพลประวัติและผลงานข่าวสารกิจกรรมวิดีโอมูลนิธิไทยรัฐ ติดตามเราได้ที่ Facebook Instagram Youtube tiktok •ร่วมงานกับเรา•เกี่ยวกับเรา•ติดต่อโฆษณา•ติดต่อเรา
general_news.txt,ประตูปริศนาที่อยู่ในสนามบินมีไว้ทำอะไร?,"21 มี.ค. 2567 15:58 น.ข่าวในกระแสไทยรัฐออนไลน์ทอท. เฉลยแล้ว หลังโซเชียลถามประตูปริศนาในสนามบินสุวรรณภูทิมีไว้ทำไม-กกก+LightDarkฟังข่าวแชร์ข่าวทอท. ตอบแล้ว หลังโซเชียลแห่ถามประตูปริศนาในสนามบินสุวรรณภูมิมีไว้ทำไม เฉลยคือ ประตูหนีไฟ
ที่ใช้เป็นทางออกฉุกเฉินเมื่อเกิดเหตุเพลิงไหม้
วันที่ 21 มี.ค. 2567 มีรายงานว่า จากกรณีผู้ใช้เฟซบุ๊กรายหนึ่งได้โพสต์ภาพประตูปริศนาที่อยู่ภายในสนามบิน ลงในกลุ่มสถาปนิกคิดอะไร? ภาค2 โดยระบุข้อความว่า ""ประตูนี้เขาเอาไว้ทำอะไรครับ เจอที่ sat1 สุวรรณภูมิครับ"" ซึ่งต่อมาได้มีคนเข้ามาแสดงความคิดเห็นและแชร์ต่อไปจำนวนมากล่าสุด แฟนเพจ
AOT Official ของ บริษัท ท่าอากาศยานไทย จำกัด (มหาชน) ได้เฉลยว่า หรือนี่ ... คือประตูไปไหนก็ได้ !! จริง ๆ แล้วเป็นประตูหนีไฟ ที่ใช้เป็นทางออกฉุกเฉินเมื่อเกิดเหตุเพลิงไหม้จะมีม่านกันควันเลื่อนลงมาปิดและสามารถกันความร้อนได้ 500-1,000"
general_news.txt,ประตูหนีไฟที่ใช้เป็นทางออกฉุกเฉินของยุทธการบินแห่งประเทศไทย,"จำกัด (มหาชน) ได้เฉลยว่า หรือนี่ ... คือประตูไปไหนก็ได้ !! จริง ๆ แล้วเป็นประตูหนีไฟ ที่ใช้เป็นทางออกฉุกเฉินเมื่อเกิดเหตุเพลิงไหม้จะมีม่านกันควันเลื่อนลงมาปิดและสามารถกันความร้อนได้ 500-1,000 องศาเซลเซียส.ข้อมูลจาก
แฟนเพจ AOT Official(อ่าน ""ข่าวโซเชียล"" ทั้งหมดที่นี่)........."
general_news.txt,คุณสนใจอ่านข่าวหรือดูวิดีโอเกี่ยวกับช่วงไหนของเนื้อหา?,Logo Thairathicon membericon searchข่าววิดีโอหนังสือพิมพ์ไทยรัฐทีวีไลฟ์สไตล์กีฬาบันเทิงดวงหวยนิยายช็อปปิ้งMONEYMIRRORTHAIRATH +LIVEข่าวข่าวทั้งหมดพระราชสำนักทั่วไทยในกระแสการเมืองเศรษฐกิจต่างประเทศอาชญากรรมยานยนต์เทคโนโลยีราคาทองคำรายงานพิเศษเกษตรความยั่งยืนคอลัมน์Refresh Storiesบันเทิงข่าวทั้งหมดข่าวบันเทิงดารา เซเลบกอสซิบนางงามละคร ซีรีย์เพลงหนังนิยายไลฟ์สไตล์ข่าวทั้งหมดสุขภาพและความงามไอทีไลฟ์สไตล์ 45+ท่องเที่ยวพระเครื่องประวัติบุคคลวิดีโอวิดีโอทั้งหมดคลิปเด่นThairath TalkสถานีผีดุคลับรถMoneyThairath PlusPeepzMIRRORPodcastหวยตรวจหวยตรวจหวยย้อนหลังสถิติหวยข่าวเลขเด็ดดวงดูดวงรายวันทำนายฝันดูดวงไพ่ยิปซีดูดวงความรักดูดวงราศีดูดวงนักษัตรดวงรายสัปดาห์ดวงรายเดือนดวงน่าอ่านวอลมงคลหนังสือพิมพ์หนังสือพิมพ์ล่าสุดคอลัมน์หนังสือพิมพ์หนังสือพิมพ์ย้อนหลังInfographicThairath
general_news.txt,ได้คุยเกี่ยวกับกีฬาหรือข่าวที่สนใจไปไหม?,Talkกีฬาข่าวทั้งหมดฟุตบอลต่างประเทศฟุตบอลไทยSport Insiderไฟต์สปอร์ตกีฬาโลกวิดีโอแกลเลอรี่Thairath Shoppingช้อปปิ้งซื้อ-ขายส่วนลดThairath MoneyInvestmentPersonal Finance EconomicsBusiness & MarketingTech & InnovationSustainabilityExperts PoolVideosPR NewsThairath PlusPolitics & SocietyEveryday LifeSubcultureNature MatterMIRRORLIFEWELLNESSCULTUREBEAUTYVIDEOไทยรัฐ TVรายการทั้งหมดLiveดูย้อนหลังผังรายการFuture Perfectมูลนิธิไทยรัฐเกี่ยวกับมูลนิธิไทยรัฐ100ปีกำพล วัชรพลประวัติและผลงานข่าวสารกิจกรรมวิดีโอมูลนิธิไทยรัฐ ติดตามเราได้ที่ Facebook Instagram Youtube tiktok •ร่วมงานกับเรา•เกี่ยวกับเรา•ติดต่อโฆษณา•ติดต่อเรา
general_news.txt,ประกันความปลอดภัยสำหรับการก่อสร้างสะพานข้ามถนนที่เทิงม.23 ครบแล้วหรือยัง?,"21 มี.ค. 2567 21:11 น.ข่าวในกระแสไทยรัฐออนไลน์เจ้าหน้าที่แจงภาพแท่งปูนห้อยหวาดเสียว ยันเป็นไปตามมาตรฐานความปลอดภัย-กกก+LightDarkฟังข่าวแชร์ข่าวผู้ควบคุมการก่อสร้างสะพานข้ามถนนที่อ.เทิง การันตีความปลอดภัย หลังโซเชียลแชร์ภาพไวรัลแท่งปูนห้อยน่าหวาดเสียว ยันอุปกรณ์ทุกอย่างเป็นไปตามมาตรฐาน คาดแล้วเสร็จทั้งสายก่อนสิ้นปี 2567วันที่ 21 มี.ค. 67 ผู้สื่อข่าวรายงานว่า จากกรณีโลกออนไลน์มีการเผยแพร่ภาพการก่อสร้างสะพานข้ามถนน ซึ่งในภาพมีการห้อยชิ้นส่วนแท่งปูนไว้เหนือศีรษะ เป็นที่น่าหวาดเสียวกับผู้ใช้ถนนเป็นอย่างมาก จึงมีการถ่ายรูปมาลงเผยแพร่จนต่อมาก็มีการนำไปแชร์ต่อจนเป็นกระแส เพราะหวั่นเกิดเหตุซ้ำรอยเหมือนที่เกิดขึ้นใน กทม.
ทั้งนี้ผู้สื่อข่าวลงพื้นที่จุดก่อสร้าง ซึ่งเป็นพื้นที่บ้านห้วยระเมศ ม.23 ต.เวียง อ.เทิง จ.เชียงราย เป็นจุดก่อสร้างสะพานข้ามถนนหมายเลข 1021 และแม่น้ำลาว"
general_news.txt,สะพานข้ามแม่น้ำลาวก่อสร้างเสร็จเมื่อไหร่ในปี 2564 หรือ 2021?,"กทม.
ทั้งนี้ผู้สื่อข่าวลงพื้นที่จุดก่อสร้าง ซึ่งเป็นพื้นที่บ้านห้วยระเมศ ม.23 ต.เวียง อ.เทิง จ.เชียงราย เป็นจุดก่อสร้างสะพานข้ามถนนหมายเลข 1021 และแม่น้ำลาว โดยสะพานดังกล่าวเป็นส่วนหนึ่งของถนนบายพาสฝั่งตะวันออก อ.เทิง เป็นถนนเชื่อมต่อจากถนน R3a เชื่อมโยงการขนส่งจากไทย ส่งออก สปป.ลาว ผ่านทาง อ.เชียงของ จ.เชียงราย เชื่อมโยงระบบโลจิสติกส์ ไทย-ลาว-จีน-เมียนมา ซึ่งมีระยะทางการก่อสร้างรวม 43 กม. เริ่มตั้งแต่ถนนหมายเลข 1021 บ้านกิ่วแก้ว ม.8 ต.ห้วยข้าวก่ำ อ.จุน จ.พะเยา มาบรรจบถนนหมายเลข 1020 ที่บ้านร่องริว ม.12 ต.เวียง อ.เทิง จ.เชียงราย โดยสะพานดังกล่าวเป็นสะพานขนาดใหญ่แห่งเดียวของโครงการ มีกำหนดแล้วเสร็จประมาณเดือน พ.ค. และถนนทั้งสายจะก่อสร้างเสร็จพร้อมใช้งานประมาณเดือน ก.ย.ที่จะถึงนี้ ...น.ส.คำ ธิวงศ์ อายุ 70 ปี และนายฝาย ใจชื่น อายุ 75 ปีชาวบ้านในพื้นที่ม.23 เปิดเผยว่า"
general_news.txt,สิ่งที่ปัญหาจากการก่อสร้างสะพานน่าจะเกิดจากอะไรบ้าง?,"มีกำหนดแล้วเสร็จประมาณเดือน พ.ค. และถนนทั้งสายจะก่อสร้างเสร็จพร้อมใช้งานประมาณเดือน ก.ย.ที่จะถึงนี้ ...น.ส.คำ ธิวงศ์ อายุ 70 ปี และนายฝาย ใจชื่น อายุ 75 ปีชาวบ้านในพื้นที่ม.23 เปิดเผยว่า เคยเห็นข่าวในทีวีว่ามีเหตุการณ์สะพานถล่มใน กทม. ก็รู้สึกหวาดกลัวกับสิ่งที่เกิดขึ้น แต่สำหรับการก่อสร้างสะพานที่บริเวณใกล้ทางเข้าเรือนจำนี้พวกตนไม่ค่อยมีความวิตกกังวล เพราะเห็นว่ามีการป้องกันอันตราย มีตำรวจมาคอยโบกรถ คิดว่าคงไม่มีอะไรเกิดขึ้น
และพวกคนงานเมียนมาก็มาเคยมาเล่าให้ฟังว่าได้มีการเพิ่มเหล็กเข้าไปในโครงสร้าง เพื่อเพิ่มความแข็งแรง ทำให้การก่อสร้างอาจล่าช้าไปบ้าง พวกตนคิดว่าสิ่งที่เป็นปัญหาน่าจะเป็นการระบายนาที่ไหลมาจากเรือนจำมากกว่า เพราะวันก่อนผู้รับเหมานำดินมากองปิดทางน้ำ ทำให้เกิดมีน้ำท่วมขังบริเวณทางเข้าไปเรือนจำอำเภอเทิง แต่ตอนนี้ได้รับการแก้ไขไปแล้ว ด้านนายปิยะพงษ์ สุพรหม อายุ 35 ปี"
general_news.txt,สร้างสะพานซับซ้อนหรือผิดปกติหรือไม่?,เพราะวันก่อนผู้รับเหมานำดินมากองปิดทางน้ำ ทำให้เกิดมีน้ำท่วมขังบริเวณทางเข้าไปเรือนจำอำเภอเทิง แต่ตอนนี้ได้รับการแก้ไขไปแล้ว ด้านนายปิยะพงษ์ สุพรหม อายุ 35 ปีช่างรับเหมาที่มีบ้านอยู่ใกล้กับจุดก่อสร้างสะพาน เปิดเผยว่า จุดที่สร้างสะพานที่ปรากฏเป็นภาพในโซเซียลนั้น ตนก็คิดว่าค่อนข้างจะน่าหวาดเสียวเหมือนกัน และมีการสร้างทางเบี่ยงด้านเดียว ฝั่งขาเข้า อ.เทิง ไม่มีการสร้างทางเบี่ยง ไม่แน่ใจว่าติดปัญหาอะไรสักอย่าง ที่จริงควรสร้างทางเบี่ยงทั้ง 2 ด้าน แต่การก่อสร้างก็ได้แล้วเสร็จไปแล้ว ไม่มีการเกิดเหตุตามที่หลายคนกังวล นายอภิชาติทองบ่อ อายุ 36 ปี เจ้าของคลิปวิดีโอขณะขี่ลอดจุดก่อสร้าง เล่าว่า วันที่ก่อสร้างน่าจะเป็นวันที่ 13 มี.ค. ช่วงตอนเย็น ตนขี่รถมาเห็นว่ามีชิ้นส่วนสะพานห้อยต่องแต่งอยู่เหนือศีรษะ เป็นที่น่าหวาดเสียว ก็เลยหยิบมือถือมาถ่ายและนำไปลงในโซเชียล แต่หลังจากนั้นอีกประมาณ 2-3 วัน
