doc,question,ref,retrieve,correct,retrieve_rerank,correct_rerank
digimoney.txt,พาณิชย์ได้เสนอนโยบายเติมเงินผ่านวอลเล็ต แต่ข้อกฎหมายยังไม่ชัดเจน บรรทัดสุดท้าย คณะกรรมการดิจิทัลวอลเล็ตยังไม่แน่ใจว่าทำได้หรือไม่?,"‘ภูมิธรรม’ เผย ร่างพ.ร.บ.เงินกู้ 5 แสนล้าน ‘ดิจิทัลวอลเล็ต’ ยังไม่เสร็จ รอส่งกฤษฎีกาตีความ ยารัฐบาลออก พ.ร.ก.ได้แต่ไม่ทำ ขอใช้รัฐสภาให้ทุกฝ่ายสบายใจ มั่นใจได้ข้อสรุปโดยเร็ว
นายภูมิธรรม เวชยชัย รองนายกรัฐมนตรี และรมว.พาณิชย์ ให้สัมภาษณ์ในวันนี้ (17 พ.ย. 66) ถึงความคืบหน้านโยบายเติมเงิน 10,000 บาท ผ่านดิจิทัลวอลเล็ตของรัฐบาลว่า คณะกรรมการดิจิทัลวอลเล็ตฯ ได้พูดคุยกันในประเด็นต่างๆ ว่า การดำเนินการจะเป็นไปอย่างรอบด้านหรือไม่ส่วนการที่คณะกรรมการกฤษฎีการะบุว่าอยากจะช่วยดูรายละเอียด ถ้าเกิดมีความชัดเจนในเรื่องข้อกฎหมายทุกฝ่ายจะได้สบายใจ แต่ไม่ได้หมายความว่า กฤษฎีกาจะปฏิเสธ ซึ่งตอนนี้ก็ยังอยู่ในกระบวนการ คาดว่าน่าจะทำโดยเร็วที่สุด ถ้าสรุปได้ข้อชัดเจนอย่างไรก็จะดำเนินการตามนั้น","‘ภูมิธรรม’ เผย ร่างพ.ร.บ.เงินกู้ 5 แสนล้าน ‘ดิจิทัลวอลเล็ต’ ยังไม่เสร็จ รอส่งกฤษฎีกาตีความ ยารัฐบาลออก พ.ร.ก.ได้แต่ไม่ทำ ขอใช้รัฐสภาให้ทุกฝ่ายสบายใจ มั่นใจได้ข้อสรุปโดยเร็ว
นายภูมิธรรม เวชยชัย รองนายกรัฐมนตรี และรมว.พาณิชย์ ให้สัมภาษณ์ในวันนี้ (17 พ.ย. 66) ถึงความคืบหน้านโยบายเติมเงิน 10,000 บาท ผ่านดิจิทัลวอลเล็ตของรัฐบาลว่า คณะกรรมการดิจิทัลวอลเล็ตฯ ได้พูดคุยกันในประเด็นต่างๆ ว่า การดำเนินการจะเป็นไปอย่างรอบด้านหรือไม่ส่วนการที่คณะกรรมการกฤษฎีการะบุว่าอยากจะช่วยดูรายละเอียด ถ้าเกิดมีความชัดเจนในเรื่องข้อกฎหมายทุกฝ่ายจะได้สบายใจ แต่ไม่ได้หมายความว่า กฤษฎีกาจะปฏิเสธ ซึ่งตอนนี้ก็ยังอยู่ในกระบวนการ คาดว่าน่าจะทำโดยเร็วที่สุด ถ้าสรุปได้ข้อชัดเจนอย่างไรก็จะดำเนินการตามนั้น",1,"‘ภูมิธรรม’ เผย ร่างพ.ร.บ.เงินกู้ 5 แสนล้าน ‘ดิจิทัลวอลเล็ต’ ยังไม่เสร็จ รอส่งกฤษฎีกาตีความ ยารัฐบาลออก พ.ร.ก.ได้แต่ไม่ทำ ขอใช้รัฐสภาให้ทุกฝ่ายสบายใจ มั่นใจได้ข้อสรุปโดยเร็ว
นายภูมิธรรม เวชยชัย รองนายกรัฐมนตรี และรมว.พาณิชย์ ให้สัมภาษณ์ในวันนี้ (17 พ.ย. 66) ถึงความคืบหน้านโยบายเติมเงิน 10,000 บาท ผ่านดิจิทัลวอลเล็ตของรัฐบาลว่า คณะกรรมการดิจิทัลวอลเล็ตฯ ได้พูดคุยกันในประเด็นต่างๆ ว่า การดำเนินการจะเป็นไปอย่างรอบด้านหรือไม่ส่วนการที่คณะกรรมการกฤษฎีการะบุว่าอยากจะช่วยดูรายละเอียด ถ้าเกิดมีความชัดเจนในเรื่องข้อกฎหมายทุกฝ่ายจะได้สบายใจ แต่ไม่ได้หมายความว่า กฤษฎีกาจะปฏิเสธ ซึ่งตอนนี้ก็ยังอยู่ในกระบวนการ คาดว่าน่าจะทำโดยเร็วที่สุด ถ้าสรุปได้ข้อชัดเจนอย่างไรก็จะดำเนินการตามนั้น",1
digimoney.txt,ระยะเวลากฤษฎีกาเร็วหรือนานอย่างไร?,"นายภูมิธรรม กล่าวต่อว่า ขณะนี้เราพยายามรับฟังเสียงข้อเสนอแนะให้ครอบคลุมมากที่สุด กรณีหากรัฐบาลจะออกเป็นพระราชกำหนด หรือ พ.ร.ก. สามารถทำได้ แต่เพียงอยากให้ทุกคนสบายใจ การเสนอเข้ารัฐสภาน่าจะเป็นทางออกที่ดีที่สุด ซึ่งต้องรอกฤษฎีกาตีความออกมาอย่างชัดเจน ตอนนี้เป็นไปตามขั้นตอนไม่ได้มีปัญหาอะไร
ส่วนขั้นตอนของกฤษฎีกาจะใช้เวลานานหรือไม่นั้น นายภูมิธรรม ระบุว่า ขึ้นอยู่กับกฤษฎีกา แต่คิดว่าเร็วที่สุด เพราะทุกคนรู้ว่าเป็นเรื่องด่วนที่จะต้องทำ
ส่วนเงื่อนไขจะมีการปรับเปลี่ยนอีกหรือไม่นายภูมิธรรม ยาว่า จะต้องฟังทางกฤษฎีกา ถ้าเกิดว่ากฤษฎีกา บอกว่าไม่มีปัญหาอะไรก็ผ่านได้เลย แต่ถ้ามีข้อท้วงติงก็จะต้องมีการประชุมกันอีก ถ้าเป็นเรื่องเล็กน้อยก็จะเป็นการปรับและนำเสนอได้เลยเช่นกัน","นายภูมิธรรม กล่าวต่อว่า ขณะนี้เราพยายามรับฟังเสียงข้อเสนอแนะให้ครอบคลุมมากที่สุด กรณีหากรัฐบาลจะออกเป็นพระราชกำหนด หรือ พ.ร.ก. สามารถทำได้ แต่เพียงอยากให้ทุกคนสบายใจ การเสนอเข้ารัฐสภาน่าจะเป็นทางออกที่ดีที่สุด ซึ่งต้องรอกฤษฎีกาตีความออกมาอย่างชัดเจน ตอนนี้เป็นไปตามขั้นตอนไม่ได้มีปัญหาอะไร
ส่วนขั้นตอนของกฤษฎีกาจะใช้เวลานานหรือไม่นั้น นายภูมิธรรม ระบุว่า ขึ้นอยู่กับกฤษฎีกา แต่คิดว่าเร็วที่สุด เพราะทุกคนรู้ว่าเป็นเรื่องด่วนที่จะต้องทำ
ส่วนเงื่อนไขจะมีการปรับเปลี่ยนอีกหรือไม่นายภูมิธรรม ยาว่า จะต้องฟังทางกฤษฎีกา ถ้าเกิดว่ากฤษฎีกา บอกว่าไม่มีปัญหาอะไรก็ผ่านได้เลย แต่ถ้ามีข้อท้วงติงก็จะต้องมีการประชุมกันอีก ถ้าเป็นเรื่องเล็กน้อยก็จะเป็นการปรับและนำเสนอได้เลยเช่นกัน",1,"นายภูมิธรรม กล่าวต่อว่า ขณะนี้เราพยายามรับฟังเสียงข้อเสนอแนะให้ครอบคลุมมากที่สุด กรณีหากรัฐบาลจะออกเป็นพระราชกำหนด หรือ พ.ร.ก. สามารถทำได้ แต่เพียงอยากให้ทุกคนสบายใจ การเสนอเข้ารัฐสภาน่าจะเป็นทางออกที่ดีที่สุด ซึ่งต้องรอกฤษฎีกาตีความออกมาอย่างชัดเจน ตอนนี้เป็นไปตามขั้นตอนไม่ได้มีปัญหาอะไร
ส่วนขั้นตอนของกฤษฎีกาจะใช้เวลานานหรือไม่นั้น นายภูมิธรรม ระบุว่า ขึ้นอยู่กับกฤษฎีกา แต่คิดว่าเร็วที่สุด เพราะทุกคนรู้ว่าเป็นเรื่องด่วนที่จะต้องทำ
ส่วนเงื่อนไขจะมีการปรับเปลี่ยนอีกหรือไม่นายภูมิธรรม ยาว่า จะต้องฟังทางกฤษฎีกา ถ้าเกิดว่ากฤษฎีกา บอกว่าไม่มีปัญหาอะไรก็ผ่านได้เลย แต่ถ้ามีข้อท้วงติงก็จะต้องมีการประชุมกันอีก ถ้าเป็นเรื่องเล็กน้อยก็จะเป็นการปรับและนำเสนอได้เลยเช่นกัน",1
digimoney.txt,ถ้าโครงการไม่สามารถทำได้จะยุติเลยหรือไม่นายภูมิธรรม?,ผู้สื่อข่าวถามว่า หากท้ายที่สุดแล้วโครงการดังกล่าวไม่สามารถทำได้จะต้องยุติเลยหรือไม่นายภูมิธรรม ระบุว่า ยังไม่รู้ว่าข้อกฎหมายจะออกมาเป็นแบบไหน การจะตัดสินใจอย่างไรขึ้นอยู่กับข้อเท็จจริงทางกฎหมาย,ผู้สื่อข่าวถามว่า หากท้ายที่สุดแล้วโครงการดังกล่าวไม่สามารถทำได้จะต้องยุติเลยหรือไม่นายภูมิธรรม ระบุว่า ยังไม่รู้ว่าข้อกฎหมายจะออกมาเป็นแบบไหน การจะตัดสินใจอย่างไรขึ้นอยู่กับข้อเท็จจริงทางกฎหมาย,1,"นายภูมิธรรม กล่าวต่อว่า ขณะนี้เราพยายามรับฟังเสียงข้อเสนอแนะให้ครอบคลุมมากที่สุด กรณีหากรัฐบาลจะออกเป็นพระราชกำหนด หรือ พ.ร.ก. สามารถทำได้ แต่เพียงอยากให้ทุกคนสบายใจ การเสนอเข้ารัฐสภาน่าจะเป็นทางออกที่ดีที่สุด ซึ่งต้องรอกฤษฎีกาตีความออกมาอย่างชัดเจน ตอนนี้เป็นไปตามขั้นตอนไม่ได้มีปัญหาอะไร
ส่วนขั้นตอนของกฤษฎีกาจะใช้เวลานานหรือไม่นั้น นายภูมิธรรม ระบุว่า ขึ้นอยู่กับกฤษฎีกา แต่คิดว่าเร็วที่สุด เพราะทุกคนรู้ว่าเป็นเรื่องด่วนที่จะต้องทำ
ส่วนเงื่อนไขจะมีการปรับเปลี่ยนอีกหรือไม่นายภูมิธรรม ยาว่า จะต้องฟังทางกฤษฎีกา ถ้าเกิดว่ากฤษฎีกา บอกว่าไม่มีปัญหาอะไรก็ผ่านได้เลย แต่ถ้ามีข้อท้วงติงก็จะต้องมีการประชุมกันอีก ถ้าเป็นเรื่องเล็กน้อยก็จะเป็นการปรับและนำเสนอได้เลยเช่นกัน",0
earthquake-9.txt,แผ่นดินไหวในเมียนมาส่งผลกระทบตามประกอบด้วยจังหวัดใดบ้าง?,"สธ. เผย แผ่นดินไหว ในเมียนมา กระทบ รพ. 14 แห่ง ใน 3 จังหวัด ต้องปิดบริการบางส่วน 2 แห่ง
นพ.ชลน่าน ศรีแก้ว รมว.สาธารณสุข เปิดเผยถึงกรณีเกิดแผ่นดินไหวความรุนแรงขนาด 6.4 ในพื้นที่จ.เชียงตุง รัฐฉาน ประเทศเมียนมา เมื่อช่วงเช้าวันนี้ (17 พ.ย. 66) ว่า การเกิดแผ่นดินไหวในครั้งนี้สามารถรับรู้แรงสั่นสะเทือนได้ถึงหลายพื้นที่ในประเทศไทย เบื้องต้นได้รับรายงานผลกระทบใน 3 จังหวัด ประกอบด้วย
1. เชียงราย มีหน่วยบริการสาธารณสุขได้รับผลกระทบ จำนวน 11 แห่ง ได้แก่ โรงพยาบาลเชียงรายประชานุเคราะห์ โรงพยาบาลแม่ลาว โรงพยาบาลสมเด็จพระญาณสังวร โรงพยาบาลแม่จัน โรงพยาบาลพาน โรงพยาบาลสมเด็จพระยุพราชเชียงของ โรงพยาบาลเชียงแสน โรงพยาบาลพญาเม็งราย โรงพยาบาลดอยหลวง โรงพยาบาลแม่ฟ้าหลวง และโรงพยาบาลแม่สาย ส่วนใหญ่พบปัญหามีรอยร้าว รอยแยกหลายจุดทั้งภายในและภายนอกอาคาร แต่ไม่ได้มีผลกระทบโครงสร้างหลัก","แผ่นดินไหว ในเมียนมา หลายพื้นที่ภาคเหนือของไทย รวมทั้งถึงตึกสูงในกทม. รับรู้แรงสั่นสะเทิอน
กองเฝ้าระวังแผ่นดินไหว กรมอุตุนิยมวิทยา รายงานว่า เวลา 8.37 น. ของวันที่ 17 พ.ย. 66 ตามเวลาในประเทศไทย ได้เกิดแผ่นดินไหว ศูนย์กลางในประเทศเมียนมา เบื้องต้น มีขนาดความรุนแรง 6.4 แมกนิจูด ที่ความลึก 9 กิโลเมตร
แรงสั่นสะเทือนสามารถรับรู้ได้ในหลายพื้นที่ในภาคเหนือของไทย เช่นเชียงใหม่, เชียงราย, ลำปาง, ลำพูน, น่าน และแม่ฮ่องสอน รวมถึงตึกสูงในกรุงเทพฯ
จากนั้นได้สรุปการเกิดแผ่นดินไหวจุดศูนย์กลาง บริเวณประเทศเมียนมา ขนาด 6.4 ความลึก 9 กิโลเมตร ห่างจาก อ.แม่สาย จ.เชียงราย ประมาณ 100 กิโลเมตร ได้รับแจ้งรู้สึกสั่นไหวบริเวณ จังหวัดเชียงราย เชียงใหม่ แม่ฮ่องสอน ลำปาง ลำพูน น่าน อุดรธานีขอนแก่น กรุงเทพฯ และปริมณฑล อีกทั้งมีแผ่นดินไหวตามมาอีก ขนาด 2.8 – 4.7 จำนวน 11 ครั้ง",0,"สธ. เผย แผ่นดินไหว ในเมียนมา กระทบ รพ. 14 แห่ง ใน 3 จังหวัด ต้องปิดบริการบางส่วน 2 แห่ง
นพ.ชลน่าน ศรีแก้ว รมว.สาธารณสุข เปิดเผยถึงกรณีเกิดแผ่นดินไหวความรุนแรงขนาด 6.4 ในพื้นที่จ.เชียงตุง รัฐฉาน ประเทศเมียนมา เมื่อช่วงเช้าวันนี้ (17 พ.ย. 66) ว่า การเกิดแผ่นดินไหวในครั้งนี้สามารถรับรู้แรงสั่นสะเทือนได้ถึงหลายพื้นที่ในประเทศไทย เบื้องต้นได้รับรายงานผลกระทบใน 3 จังหวัด ประกอบด้วย
1. เชียงราย มีหน่วยบริการสาธารณสุขได้รับผลกระทบ จำนวน 11 แห่ง ได้แก่ โรงพยาบาลเชียงรายประชานุเคราะห์ โรงพยาบาลแม่ลาว โรงพยาบาลสมเด็จพระญาณสังวร โรงพยาบาลแม่จัน โรงพยาบาลพาน โรงพยาบาลสมเด็จพระยุพราชเชียงของ โรงพยาบาลเชียงแสน โรงพยาบาลพญาเม็งราย โรงพยาบาลดอยหลวง โรงพยาบาลแม่ฟ้าหลวง และโรงพยาบาลแม่สาย ส่วนใหญ่พบปัญหามีรอยร้าว รอยแยกหลายจุดทั้งภายในและภายนอกอาคาร แต่ไม่ได้มีผลกระทบโครงสร้างหลัก",1
