doc,question,ref,retrieve,correct,retrieve_rerank,correct_rerank
general_news.txt,การดำเนินการเมื่อโทรศัพท์มือถือโดนรีโมทกควบคุมจากระยะไกลคืออะไรบ้าง?,"ตำรวจสอบสวนกลาง (CIB) แนะนำหากโทรศัพท์มือถือโดนรีโมตควบคุมจากระยะไกล ให้ทำตามขั้นตอนดังต่อไปนี้1. หากยังสามารถสัมผัสหน้าจอโทรศัพท์ได้ ให้รีบตัดสัญญาณอินเทอร์เน็ต โดยการปิดไวไฟ ปิดเซลลูลาร์ ปิดบลูทูธ และเปิด airplan mode (โหมดเครื่องบิน) จากนั้นลบแอปฯ แปลกปลอมออกจากเครื่องทันที2. หากไม่สามารถสัมผัสหน้าจอได้หรือหน้าจอเป็นสีดาในระบบ IOS กดปุ่มเพิ่มเสียง 1 ครั้ง > กดปุ่มลดเสียง 1 ครั้ง > กดปุ่มเปิด/ปิดเครื่องค้างไว้จนกว่าหน้าจอจะขึ้นรูปแอปเปิล เมื่อเครื่องเปิดมาใหม่ให้รีบตัดสัญญาณอินเทอร์เน็ต โดยการปิดไวไฟ ปิดเซลลูลาร์ ปิดบลูทูธ และเปิด airplan mode (โหมดเครื่องบิน) จากนั้นลบแอปฯ แปลกปลอมออกจากเครื่องทันที
ในระบบ Android กดปุ่มเปิด/ปิดเครื่อง ค้างไว้ประมาณ 20-30 วินาทีรอจนหน้าจอดับไป รอจนกว่าเครื่องจะเปิดขึ้นใหม่ (อาจใช้เวลาสักระยะนึง) เมื่อเครื่องเปิดมาใหม่ให้รีบตัดสัญญาณอินเทอร์เน็ต","Remote Access ลงบนโทรศัพท์มือถือ ส่งผลทำให้มิจฉาชีพสามารถควบคุมโทรศัพท์ และโอนเงินออกจากบัญชีของเราได้ตำรวจสอบสวนกลาง (CIB) จึงขอแนะนำหากโทรศัพท์มือถือโดนรีโมตควบคุมจากระยะไกล ให้ทำตามขั้นตอนดังต่อไปนี้1. หากยังสามารถสัมผัสหน้าจอโทรศัพท์ได้ ให้รีบตัดสัญญาณอินเทอร์เน็ต โดยการปิดไวไฟ ปิดเซลลูลาร์ ปิดบลูทูธ และเปิด airplan mode (โหมดเครื่องบิน) จากนั้นลบแอปแปลกปลอมออกจากเครื่องทันที2. หากไม่สามารถสัมผัสหน้าจอได้หรือหน้าจอเป็นสีดาระบบ IOSกดปุ่มเพิ่มเสียง 1 ครั้ง > กดปุ่มลดเสียง 1 ครั้ง > กดปุ่มเปิด/ปิดเครื่องค้างไว้จนกว่าหน้าจอจะขึ้นรูปแอปเปิล เมื่อเครื่องเปิดมาใหม่ให้รีบตัดสัญญาณอินเทอร์เน็ต โดยการปิดไวไฟ ปิดเซลลูลาร์ ปิดบลูทูธ และเปิด airplan mode (โหมดเครื่องบิน) จากนั้นลบแอปแปลกปลอมออกจากเครื่องทันที
ระบบ Androidกดปุ่มเปิด/ปิดเครื่อง ค้างไว้ประมาณ 20-30 วินาทีรอจนหน้าจอดับไป",0,"22 มี.ค. 2567 09:40 น.ข่าวในกระแสไทยรัฐออนไลน์ตำรวจแนะ 3 วิธี เมื่อโทรศัพท์มือถือโดน ""มิจฉาชีพ"" รีโมตควบคุมจากระยะไกล-กกก+LightDarkฟังข่าวแชร์ข่าว""ตำรวจสอบสวนกลาง"" แนะนำ 3 วิธีเมื่อโทรศัพท์มือถือโดน ""มิจฉาชีพ"" รีโมตควบคุมจากระยะไกล พร้อมยาเพื่อป้องกันไม่ให้ถูกมิจฉาชีพควบคุมจากระยะไกล ต้องไม่กดลิงก์หรือดาวน์โหลดแอปพลิเคชันที่ไม่ได้อยู่ใน APP Store หรือ Play Storeเฟซบุ๊ก
ตำรวจสอบสวนกลาง โพสต์ข้อความเรื่อง ""ทำอย่างไรเมื่อโทรศัพท์มือถือ โดนรีโมตควบคุมจากระยะไกล"" โดยระบุว่า ""จากกรณีที่มิจฉาชีพหลอกให้กดลิงก์เพื่อดาวน์โหลดแอปพลิเคชันที่ไม่ได้อยู่ใน APP Store หรือ Play Store ทำให้ถูกติดตั้งแอปพลิเคชัน Remote Access ลงบนโทรศัพท์มือถือ ส่งผลทำให้มิจฉาชีพสามารถควบคุมโทรศัพท์ และโอนเงินออกจากบัญชีของเราได้ตำรวจสอบสวนกลาง (CIB) จึงขอแนะนำหากโทรศัพท์มือถือโดนรีโมตควบคุมจากระยะไกล",0
general_news.txt,คำว่าAndroidกดปุ่มเปิด/ปิดเครื่องนั้นหมายถึงอะไรบ้าง?,Android กดปุ่มเปิด/ปิดเครื่อง ค้างไว้ประมาณ 20-30 วินาทีรอจนหน้าจอดับไป รอจนกว่าเครื่องจะเปิดขึ้นใหม่ (อาจใช้เวลาสักระยะนึง) เมื่อเครื่องเปิดมาใหม่ให้รีบตัดสัญญาณอินเทอร์เน็ต โดยการปิดไวไฟ ปิดเซลลูลาร์ ปิดบลูทูธ และเปิด airplan mode (โหมดเครื่องบิน) จากนั้นลบแอปฯ แปลกปลอมออกจากเครื่องทันที3. หากไม่สามารถทำตามขั้นตอนที่ 1 และขั้นตอนที่ 2 ได้ ให้ปิด WiFi Router และถอดปลั๊ก จากนั้นให้ถอดซิมออกจากโทรศัพท์มือถือทันที...“เพื่อเป็นการป้องกันไม่ให้โทรศัพท์ถูกมิจฉาชีพควบคุมจากระยะไกล ต้องไม่กดลิงก์หรือดาวน์โหลดแอปพลิเคชันที่ไม่ได้อยู่ใน App Store หรือ Play Store ทั้งนี้หากท่านตกเป็นเหยื่อของมิจฉาชีพออนไลน์ สามารถแจ้งเข้ามาที่ศูนย์ AOC 1441 เพื่อทำการอายัดบัญชีคนร้าย และดำเนินคดีตามกฎหมายกับมิจฉาชีพ” นายคารม ยา......,Android กดปุ่มเปิด/ปิดเครื่อง ค้างไว้ประมาณ 20-30 วินาทีรอจนหน้าจอดับไป รอจนกว่าเครื่องจะเปิดขึ้นใหม่ (อาจใช้เวลาสักระยะนึง) เมื่อเครื่องเปิดมาใหม่ให้รีบตัดสัญญาณอินเทอร์เน็ต โดยการปิดไวไฟ ปิดเซลลูลาร์ ปิดบลูทูธ และเปิด airplan mode (โหมดเครื่องบิน) จากนั้นลบแอปฯ แปลกปลอมออกจากเครื่องทันที3. หากไม่สามารถทำตามขั้นตอนที่ 1 และขั้นตอนที่ 2 ได้ ให้ปิด WiFi Router และถอดปลั๊ก จากนั้นให้ถอดซิมออกจากโทรศัพท์มือถือทันที...“เพื่อเป็นการป้องกันไม่ให้โทรศัพท์ถูกมิจฉาชีพควบคุมจากระยะไกล ต้องไม่กดลิงก์หรือดาวน์โหลดแอปพลิเคชันที่ไม่ได้อยู่ใน App Store หรือ Play Store ทั้งนี้หากท่านตกเป็นเหยื่อของมิจฉาชีพออนไลน์ สามารถแจ้งเข้ามาที่ศูนย์ AOC 1441 เพื่อทำการอายัดบัญชีคนร้าย และดำเนินคดีตามกฎหมายกับมิจฉาชีพ” นายคารม ยา......,1,"Remote Access ลงบนโทรศัพท์มือถือ ส่งผลทำให้มิจฉาชีพสามารถควบคุมโทรศัพท์ และโอนเงินออกจากบัญชีของเราได้ตำรวจสอบสวนกลาง (CIB) จึงขอแนะนำหากโทรศัพท์มือถือโดนรีโมตควบคุมจากระยะไกล ให้ทำตามขั้นตอนดังต่อไปนี้1. หากยังสามารถสัมผัสหน้าจอโทรศัพท์ได้ ให้รีบตัดสัญญาณอินเทอร์เน็ต โดยการปิดไวไฟ ปิดเซลลูลาร์ ปิดบลูทูธ และเปิด airplan mode (โหมดเครื่องบิน) จากนั้นลบแอปแปลกปลอมออกจากเครื่องทันที2. หากไม่สามารถสัมผัสหน้าจอได้หรือหน้าจอเป็นสีดาระบบ IOSกดปุ่มเพิ่มเสียง 1 ครั้ง > กดปุ่มลดเสียง 1 ครั้ง > กดปุ่มเปิด/ปิดเครื่องค้างไว้จนกว่าหน้าจอจะขึ้นรูปแอปเปิล เมื่อเครื่องเปิดมาใหม่ให้รีบตัดสัญญาณอินเทอร์เน็ต โดยการปิดไวไฟ ปิดเซลลูลาร์ ปิดบลูทูธ และเปิด airplan mode (โหมดเครื่องบิน) จากนั้นลบแอปแปลกปลอมออกจากเครื่องทันที
ระบบ Androidกดปุ่มเปิด/ปิดเครื่อง ค้างไว้ประมาณ 20-30 วินาทีรอจนหน้าจอดับไป",0
general_news.txt,"Is there a specific reason for you mentioning various sections of the ""Thairath"" website in your content?","Thairath OnlineThairath MoneyThairath SportThairath TVThairath PlusMIRRORHomeArticlesVideoInfographicSustainability ReportPR NewsHomeArticlesVideoInfographicSustainability ReportPR NewsFollow us|THAIRATH ONLINEThairath PlusThairath SportThairath MoneyThairath ShoppingThairath TVThairath logisticsMIRRORมูลนิธิไทยรัฐ100ปีกำพล วัชรพลSearchFuture PerfectArticles22 มีนาคม ""วันอนุรักษ์นาโลก"" เพื่อตระหนักให้เห็นความสำคัญ ในการใช้ทรัพยากรนา","Thairath OnlineThairath MoneyThairath SportThairath TVThairath PlusMIRRORHomeArticlesVideoInfographicSustainability ReportPR NewsHomeArticlesVideoInfographicSustainability ReportPR NewsFollow us|THAIRATH ONLINEThairath PlusThairath SportThairath MoneyThairath ShoppingThairath TVThairath logisticsMIRRORมูลนิธิไทยรัฐ100ปีกำพล วัชรพลSearchFuture PerfectArticles22 มีนาคม ""วันอนุรักษ์นาโลก"" เพื่อตระหนักให้เห็นความสำคัญ ในการใช้ทรัพยากรนา",1,"Thairath OnlineThairath MoneyThairath SportThairath TVThairath PlusMIRRORHomeArticlesVideoInfographicSustainability ReportPR NewsHomeArticlesVideoInfographicSustainability ReportPR NewsFollow us|THAIRATH ONLINEThairath PlusThairath SportThairath MoneyThairath ShoppingThairath TVThairath logisticsMIRRORมูลนิธิไทยรัฐ100ปีกำพล วัชรพลSearchFuture PerfectArticlesบางจากฯ จับมือ กรมอนามัย เปลี่ยนน้ำมัน ""ไม่ทอดซา"" ให้เป็นพลังงานเชื้อเพลิง",0
general_news.txt,วันอนุรักษ์นาโลกเข้ารหัส KB6310ข้อดีข้อเสีย.rdfxmlทรัพยากรน้ำการป้องกันformatในการเริ่มต้น?,"22 มีนาคม ""วันอนุรักษ์นาโลก"" เพื่อตระหนักให้เห็นความสำคัญ ในการใช้ทรัพยากรนาSustainabilityความยั่งยืน22 มี.ค. 2567 07:45 น.-กกก+LightDarkฟังข่าวSHARESHARE22 มีนาคม ""วันอนุรักษ์นาโลก"" เพื่อตระหนักให้เห็นความสำคัญในการใช้ทรัพยากรนา ขณะที่ ""นา"" ถือเป็นองค์ประกอบสำคัญของสิ่งมีชีวิตทุกชนิดเฟซบุ๊ก
กรมอุทยานแห่งชาติสัตว์ป่า และพันธุ์พืช โพสต์ข้อความเรื่อง ""วันอนุรักษ์นาโลก"" โดยระบุว่า ""22 มีนาคมของทุกปีตรงกับ ""วันอนุรักษ์นาโลก (World Water Day)"" ซึ่งมีจุดเริ่มต้นจากการประชุมเรื่องสิ่งแวดล้อมและการพัฒนาแห่งสหประชาชาติที่เมืองริโอ เดอ จาเนโร ประเทศบราซิล ในวันที่ 22 มีนาคม ปี 1992 มีเนื้อหาสำคัญโดยตระหนักถึงการใช้ทรัพยากรนาของมนุษย์ จึงมีแนวคิดที่จะจัดกิจกรรมที่จะเป็นแผนแม่บทให้ประเทศต่างๆ ทั่วโลก ได้เฝ้าระวังทรัพยากรนาในประเทศนั้นๆ แล้วสมัชชาทั่วไปแห่งสหประชาชาติก็ได้ออกประกาศให้วันที่","22 มีนาคม ""วันอนุรักษ์นาโลก"" เพื่อตระหนักให้เห็นความสำคัญ ในการใช้ทรัพยากรนาSustainabilityความยั่งยืน22 มี.ค. 2567 07:45 น.-กกก+LightDarkฟังข่าวSHARESHARE22 มีนาคม ""วันอนุรักษ์นาโลก"" เพื่อตระหนักให้เห็นความสำคัญในการใช้ทรัพยากรนา ขณะที่ ""นา"" ถือเป็นองค์ประกอบสำคัญของสิ่งมีชีวิตทุกชนิดเฟซบุ๊ก
กรมอุทยานแห่งชาติสัตว์ป่า และพันธุ์พืช โพสต์ข้อความเรื่อง ""วันอนุรักษ์นาโลก"" โดยระบุว่า ""22 มีนาคมของทุกปีตรงกับ ""วันอนุรักษ์นาโลก (World Water Day)"" ซึ่งมีจุดเริ่มต้นจากการประชุมเรื่องสิ่งแวดล้อมและการพัฒนาแห่งสหประชาชาติที่เมืองริโอ เดอ จาเนโร ประเทศบราซิล ในวันที่ 22 มีนาคม ปี 1992 มีเนื้อหาสำคัญโดยตระหนักถึงการใช้ทรัพยากรนาของมนุษย์ จึงมีแนวคิดที่จะจัดกิจกรรมที่จะเป็นแผนแม่บทให้ประเทศต่างๆ ทั่วโลก ได้เฝ้าระวังทรัพยากรนาในประเทศนั้นๆ แล้วสมัชชาทั่วไปแห่งสหประชาชาติก็ได้ออกประกาศให้วันที่",1,"22 มีนาคม ""วันอนุรักษ์นาโลก"" เพื่อตระหนักให้เห็นความสำคัญ ในการใช้ทรัพยากรนาSustainabilityความยั่งยืน22 มี.ค. 2567 07:45 น.-กกก+LightDarkฟังข่าวSHARESHARE22 มีนาคม ""วันอนุรักษ์นาโลก"" เพื่อตระหนักให้เห็นความสำคัญในการใช้ทรัพยากรนา ขณะที่ ""นา"" ถือเป็นองค์ประกอบสำคัญของสิ่งมีชีวิตทุกชนิดเฟซบุ๊ก
กรมอุทยานแห่งชาติสัตว์ป่า และพันธุ์พืช โพสต์ข้อความเรื่อง ""วันอนุรักษ์นาโลก"" โดยระบุว่า ""22 มีนาคมของทุกปีตรงกับ ""วันอนุรักษ์นาโลก (World Water Day)"" ซึ่งมีจุดเริ่มต้นจากการประชุมเรื่องสิ่งแวดล้อมและการพัฒนาแห่งสหประชาชาติที่เมืองริโอ เดอ จาเนโร ประเทศบราซิล ในวันที่ 22 มีนาคม ปี 1992 มีเนื้อหาสำคัญโดยตระหนักถึงการใช้ทรัพยากรนาของมนุษย์ จึงมีแนวคิดที่จะจัดกิจกรรมที่จะเป็นแผนแม่บทให้ประเทศต่างๆ ทั่วโลก ได้เฝ้าระวังทรัพยากรนาในประเทศนั้นๆ แล้วสมัชชาทั่วไปแห่งสหประชาชาติก็ได้ออกประกาศให้วันที่",1
