doc,question,ref
LAW_PDPA_2562.pdf,ข้อบังคับเกี่ยวกับคณะกรรมการผู้เชี่ยวชาญและการละเมิดได้รับโทษอย่างไรในกรณีไม่ปฏิบัติตาม?,"มาตรา ๘๙ ผู้ใดไม่ปฏิบัติตามคำสั่งของคณะกรรมการผู้เชี่ยวชาญหรือไม่มาชี้แจงข้อเท็จจริง
ตามมาตรา ๗๕ หรือไม่ปฏิบัติตามมาตรา ๗๖ (๑) หรือไม่อำนวยความสะดวกแก่พนักงานเจ้าหน้าที่
ตามมาตรา ๗๖ วรรคสี่ต้องระวางโทษปรับทางปกครองไม่เกินหำแสนบาท
มาตรา ๙๐ คณะกรรมการผู้เชี่ยวชาญมีอำนาจสั่งลงโทษปรับทางปกครองตามที่กำหนดไว้
ในส่วนนี้ทั้งนี้ ในกรณีที่เห็นสมควรคณะกรรมการผู้เชี่ยวชาญจะสั่งให้แก้ไขหรือตักเตือนก่อนก็ได้หน้า ๙๑
เล่ม ๑๓๖ ตอนที่ ๖๙ ก ราชกิจจานุเบกษา ๒๗ พฤษภาคม ๒๕๖๒"
LAW_PDPA_2562.pdf,คำถามคือ ในการพิจารณาลงโทษปรับทางปกครอง คณะกรรมการควรคำนึงถึงอะไรบ้าง?,"ในการพิจารณาออกคำสั่งลงโทษปรับทางปกครอง ให้คณะกรรมการผู้เชี่ยวชาญคำนึงถึง
ความร้ายแรงแห่งพฤติกรรมที่กระทำผิด ขนาดกิจการของผู้ควบคุมข้อมูลส่วนบุคคลหรือผู้ประมวลผล
ข้อมูลส่วนบุคคล หรือพฤติการณ์ต่าง ๆ ประกอบด้วย ทั้งนี้ตามหลักเกณฑ์ที่คณะกรรมการกำหนด
ในกรณีที่ผู้ถูกลงโทษปรับทางปกครองไม่ยอมชำระค่าปรับทางปกครอง ให้นำบทบัญญัติเกี่ยวกับ
การบังคับทางปกครองตามกฎหมายว่าด้วยวิธีปฏิบัติราชการทางปกครองมาใช้บังคับโดยอนุโลม และ
ในกรณีที่ไม่มีเจ้าหน้าที่ดำเนินการบังคับตามคำสั่ง หรือมีแต่ไม่สามารถดำเนินการบังคับทางปกครองได้
ให้คณะกรรมการผู้เชี่ยวชาญมีอำนาจฟ้องคดีต่อศาลปกครองเพื่อบังคับชำระค่าปรับ ในการนี้ถ้าศาลปกครอง
เห็นว่าคำสั่งให้ชำระค่าปรับนั้นชอบด้วยกฎหมาย ให้ศาลปกครองมีอำ นาจพิจารณาพิพากษา และบังคับให้มี
การยึดหรืออายัดทรัพย์สินขายทอดตลาดเพื่อชำระค่าปรับได้"
LAW_PDPA_2562.pdf,คำสั่งบังคับใช้กฎหมายทางปกครองในข้อไหน?,"เห็นว่าคำสั่งให้ชำระค่าปรับนั้นชอบด้วยกฎหมาย ให้ศาลปกครองมีอำ นาจพิจารณาพิพากษา และบังคับให้มี
การยึดหรืออายัดทรัพย์สินขายทอดตลาดเพื่อชำระค่าปรับได้
คำสั่งลงโทษปรับทางปกครองและคำสั่งในการบังคับทางปกครอง ให้นำความในมาตรา ๗๔
วรรคหก มาใช้บังคับโดยอนุโลม และให้นำความในมาตรา ๗๔ วรรคสี่มาใช้บังคับกับการบังคับ
ทางปกครองตามวรรคสามโดยอนุโลม
บทเฉพาะกาล
มาตรา ๙๑ ในวาระเริ่มแรก ให้คณะกรรมการประกอบด้วยกรรมการตามมาตรา ๘ (๒) (๓)
และให้เลขาธิการคณะกรรมการคุ้มครองข้อมูลส่วนบุคคลเป็นกรรมการและเลขานุการ เพื่อปฏิบัติหน้าที่
เท่าที่จำเป็นไปพลางก่อนแต่ไม่เกินเก้าสิบวันนับแต่วันที่พระราชบัญญัตินี้ใช้บังคับ และให้รองประธาน
กรรมการทำหน้าที่ประธานกรรมการเป็นการชั่วคราว
ให้สำนักงานดำเนินการให้มีการแต่งตั้งประธานกรรมการตามมาตรา ๘ (๑) และกรรมการ"
LAW_PDPA_2562.pdf,การแต่งตั้งเลขาธิการคณะกรรมการคุ้มครองข้อมูลส่วนบุคคลจำเป็นต้องทำภายในกี่วัน?,"กรรมการทำหน้าที่ประธานกรรมการเป็นการชั่วคราว
ให้สำนักงานดำเนินการให้มีการแต่งตั้งประธานกรรมการตามมาตรา ๘ (๑) และกรรมการ
ผู้ทรงคุณวุฒิตามมาตรา ๘ (๔) ภายในเก้าสิบวันนับแต่วันที่พระราชบัญญัตินี้ใช้บังคับ
มาตรา ๙๒ ให้ดำเนินการเพื่อให้มีคณะกรรมการกำกับสำนักงานคณะกรรมการคุ้มครอง
ข้อมูลส่วนบุคคลภายในเก้าสิบวันนับแต่วันที่ได้มีการแต่งตั้งประธานกรรมการ และกรรมการผู้ทรงคุณวุฒิ
ตามมาตรา ๙๑
ให้ดำเนินการแต่งตั้งเลขาธิการคณะกรรมการคุ้มครองข้อมูลส่วนบุคคลตามพระราชบัญญัตินี้
ให้แล้วเสร็จภายในเก้าสิบวันนับแต่วันที่จัดตั้งสำนักงานแล้วเสร็จตามมาตรา ๙๓
มาตรา ๙๓ ให้ดำเนินการจัดตั้งสำนักงานให้แล้วเสร็จเพื่อปฏิบัติงานตามพระราชบัญญัตินี้
ภายในหนึ่งปีนับแต่วันที่พระราชบัญญัตินี้ใช้บังคับ หน้า ๙๒
เล่ม ๑๓๖ ตอนที่ ๖๙ ก ราชกิจจานุเบกษา ๒๗ พฤษภาคม ๒๕๖๒"
LAW_PDPA_2562.pdf,สำนักงานปลัดกระทรวงดิจิทัลมีหน้าที่อะไรครับ?,"ในระหว่างที่การดำเนินการจัดตั้งสำนักงานยังไม่แล้วเสร็จ ให้สำนักงานปลัดกระทรวงดิจิทัล
เพื่อเศรษฐกิจและสังคมทำหน้าที่สำนักงานตามพระราชบัญญัตินี้ และให้รัฐมนตรีแต่งตั้งรองปลัด กระทรวง
ดิจิทัลเพื่อเศรษฐกิจและสังคมคนหนึ่งทำหน้าที่เลขาธิการจนกว่าจะมีการแต่ง ตั้งเลขาธิการตามมาตรา ๙๒
วรรคสอง
มาตรา ๙๔ ในวาระเริ่มแรก ให้คณะรัฐมนตรีจัดสรรทุนประเดิมให้แก่สำนักงาน
ตามความจำเป็น
ให้รัฐมนตรีเสนอต่อคณะรัฐมนตรีเพื่อพิจารณาให้ข้าราชการ พนักงาน เจ้าหน้าที่หรือ
ผู้ปฏิบัติงานอื่นใดในหน่วยงานของรัฐ มาปฏิบัติงานเป็นพนักงานของสำนักงานเป็นการชั่วคราวภายใน
ระยะเวลาที่คณะรัฐมนตรีกำหนด
ให้ถือว่าข้าราชการ พนักงาน เจ้าหน้าที่หรือผู้ปฏิบัติงานอื่นใดในหน่วยงานของรัฐที่มาปฏิบัติงาน
ในสำนักงานเป็นการชั่วคราวตามวรรคสองไม่ขาดจากสถานภาพเดิมและคงได้รับเงินเดือนหรือค่าจ้าง"
LAW_PDPA_2562.pdf,"ความหมายของ ""คัดเลือก"" คืออะไร?","ให้ถือว่าข้าราชการ พนักงาน เจ้าหน้าที่หรือผู้ปฏิบัติงานอื่นใดในหน่วยงานของรัฐที่มาปฏิบัติงาน
ในสำนักงานเป็นการชั่วคราวตามวรรคสองไม่ขาดจากสถานภาพเดิมและคงได้รับเงินเดือนหรือค่าจ้าง
แล้วแต่กรณี จากสังกัดเดิม ทั้งนี้คณะกรรมการอาจกำหนดค่าตอบแทนพิเศษให้แก่ข้าราชการ
พนักงาน เจ้าหน้าที่หรือผู้ปฏิบัติงานอื่นใดในหน่วยงานของรัฐตามวรรคสอง ในระหว่างปฏิบัติงาน
ในสำนักงานด้วยก็ได้
ภายในหนึ่งร้อยแปดสิบวันนับแต่วันที่จัดตั้งสำนักงานแล้วเสร็จ ให้สำนักงานดำเนินการคัดเลือก
ข้าราชการ พนักงาน เจ้าหน้าที่หรือผู้ปฏิบัติงานอื่นใดในหน่วยงานของรัฐตามวรรคสองเพื่อบรรจุ
เป็นพนักงานของสำนักงานต่อไป
ข้าราชการ พนักงาน เจ้าหน้าที่หรือผู้ปฏิบัติงานอื่นใดในหน่วยงานของรัฐผู้ใดได้รับการคัดเลือก"
LAW_PDPA_2562.pdf,เจ้าหน้าที่ต้องปฏิบัติตามข้อกำหนดเกี่ยวกับข้อมูลส่วนบุคคลในสถานการณ์ใดบ้าง?,"เป็นพนักงานของสำนักงานต่อไป
ข้าราชการ พนักงาน เจ้าหน้าที่หรือผู้ปฏิบัติงานอื่นใดในหน่วยงานของรัฐผู้ใดได้รับการคัดเลือก
และบรรจุตามวรรคสี่ ให้มีสิทธินับระยะเวลาทำงานที่เคยทำงานอยู่ในสังกัดเดิมต่อเนื่องรวมกับระยะเวลา
ทำงานในสำนักงานตามพระราชบัญญัตินี้
มาตรา ๙๕ ข้อมูลส่วนบุคคลที่ผู้ควบคุมข้อมูลส่วนบุคคลได้เก็บรวบรวมไว้ก่อนวันที่
พระราชบัญญัตินี้ ใช้บังคับ ให้ผู้ควบคุมข้อมูลส่วนบุคคลสามารถเก็บรวมรวมและใช้ข้อมูลส่วนบุคคลนั้น
ต่อไปได้ตามวัตถุประสงค์เดิม ทั้งนี้ผู้ควบคุมข้อมูลส่วนบุคคลต้องกำหนดวิธีการยกเลิกความยินยอม
และเผยแพร่ประชาสัมพันธ์ให้เจ้าของข้อมูลส่วนบุคคลที่ไม่ประสงค์ให้ผู้ควบคุมข้อมูลส่วนบุคคลเก็บรว มรวม
และใช้ข้อมูลส่วนบุคคลดังกล่าวสามารถแจ้งยกเลิกความยินยอมได้โดยง่าย
การเปิดเผยและการดำเนินการอื่นที่มิใช่การเก็บรวบรวมและการใช้ข้อมูลส่วนบุคคลตามวรรคหนึ่ง"
LAW_PDPA_2562.pdf,ข้อมูลส่วนบุคคลที่เก็บไว้ภายในเพจสื่อสื่กัปเราะดำเนินการโดยไรได้ในทางไหนบ้าง ,"และใช้ข้อมูลส่วนบุคคลดังกล่าวสามารถแจ้งยกเลิกความยินยอมได้โดยง่าย
การเปิดเผยและการดำเนินการอื่นที่มิใช่การเก็บรวบรวมและการใช้ข้อมูลส่วนบุคคลตามวรรคหนึ่ง
ให้เป็นไปตามบทบัญญัติแห่งพระราชบัญญัตินี้หน้า ๙๓
เล่ม ๑๓๖ ตอนที่ ๖๙ ก ราชกิจจานุเบกษา ๒๗ พฤษภาคม ๒๕๖๒"
LAW_PDPA_2562.pdf,เอาให้เค้าบางทีเนี้ยะ..?,"มาตรา ๙๖ การดำเนินการออกระเบียบ และประกาศตามพระราชบัญญัตินี้ ให้ดำเนินการ
ให้แล้วเสร็จภายในหนึ่งปีนับแต่วันที่พระราชบัญญัตินี้ใช้บังคับ หากไม่สามารถดำเนินการได้ให้รัฐมนตรี
รายงานเหตุผลที่ไม่อาจดำเนินการได้ต่อคณะรัฐมนตรีเพื่อทราบ
ผู้รับสนองพระบรมราชโองการ
พลเอก ประยุทธ์ จันทร์โอชา
นายกรัฐมนตรี
หน้า ๙๔
เล่ม ๑๓๖ ตอนที่ ๖๙ ก ราชกิจจานุเบกษา ๒๗ พฤษภาคม ๒๕๖๒"
LAW_PDPA_2562.pdf,ความสำคัญของพระราชบัญญัตินี้เกี่ยวกับความเป็นส่วนตัวของข้อมูลส่วนบุคคลคืออะไร?,"หมายเหตุ :- เหตุผลในการประกาศใช้พระราชบัญญัติฉบับนี้คือ เนื่องจากปัจจุบันมีการล่วงละเมิด
สิทธิความเป็นส่วนตัวของข้อมูลส่วนบุคคลเป็นจำนวนมากจนสร้างความเดือดร้อนรำคาญหรือความเสียหาย
ให้แก่เจ้าของข้อมูลส่วนบุคคล ประกอบกับความก้าวหน้าของเทคโนโลยีทำให้การเก็บรวบรวม ใช้หรือ
เปิดเผยข้อมูลส่วนบุคคลอันเป็นการล่วงละเมิดดังกล่าว ทำได้โดยง่าย สะดวก และรวดเร็ว ก่อให้เกิด
ความเสียหายต่อเศรษฐกิจโดยรวม สมควรกำหนดให้มีกฎหมายว่าด้วยการคุ้มครองข้อมูลส่วนบุคคล
เป็นการทั่วไปขึ้น เพื่อกำหนดหลักเกณฑ์ กลไก หรือมาตรการกำกับดูแลเกี่ยวกับการให้ความคุ้มครองข้อมูล
ส่วนบุคคลที่เป็นหลักการทั่วไป จึงจำเป็นต้องตรา พระราชบัญญัตินี้
หน้า ๙๕
เล่ม ๑๓๖ ตอนที่ ๖๙ ก ราชกิจจานุเบกษา ๒๗ พฤษภาคม ๒๕๖๒"
earthquake-mm.txt,อุตุนิยมวิทยารายงานว่าแผ่นดินไหวเกิดในประเทศใดเมียนมา ในวันที่ 17 พฤศจิกายน 66?,"แผ่นดินไหว ในเมียนมา หลายพื้นที่ภาคเหนือของไทย รวมทั้งถึงตึกสูงในกทม. รับรู้แรงสั่นสะเทิอน
กองเฝ้าระวังแผ่นดินไหว กรมอุตุนิยมวิทยา รายงานว่า เวลา 8.37 น. ของวันที่ 17 พ.ย. 66 ตามเวลาในประเทศไทย ได้เกิดแผ่นดินไหว ศูนย์กลางในประเทศเมียนมา เบื้องต้น มีขนาดความรุนแรง 6.4 แมกนิจูด ที่ความลึก 9 กิโลเมตร
แรงสั่นสะเทือนสามารถรับรู้ได้ในหลายพื้นที่ในภาคเหนือของไทย เช่นเชียงใหม่, เชียงราย, ลำปาง, ลำพูน, น่าน และแม่ฮ่องสอน รวมถึงตึกสูงในกรุงเทพฯ
จากนั้นได้สรุปการเกิดแผ่นดินไหวจุดศูนย์กลาง บริเวณประเทศเมียนมา ขนาด 6.4 ความลึก 9 กิโลเมตร ห่างจาก อ.แม่สาย จ.เชียงราย ประมาณ 100 กิโลเมตร ได้รับแจ้งรู้สึกสั่นไหวบริเวณ จังหวัดเชียงราย เชียงใหม่ แม่ฮ่องสอน ลำปาง ลำพูน น่าน อุดรธานีขอนแก่น กรุงเทพฯ และปริมณฑล อีกทั้งมีแผ่นดินไหวตามมาอีก ขนาด 2.8 – 4.7 จำนวน 11 ครั้ง"
digital-money-srettha.txt,โครงการเติมเงินดิจิทัลวอลเล็ตเพื่อส่งเสริมเศรษฐกิจ มีเงื่อนไขในการเข้ารับเงินหรือไม่?,"นายกฯ ‘เศรษฐา’ ตัดจบ ‘ดิจิทัลวอลเล็ต 10,000 บาท’ ให้ 50 ล้านคน กำหนดเงื่อนไข เงินเดือนไม่ถึง 70,000 บาท เงินฝากต่ำกว่า 500,000 บาท ต้องออก ‘พ.ร.บ.กู้เงิน’
เวลา 14.00 น. วันนี้ (10 พ.ย. 66) นายเศรษฐา ทวีสิน เปิดแถลงข่าว นโยบายโครงการเติมเงิน 10,000 บาท ผ่าน Digital Wallet (ดิจิทัลวอลเล็ต) ตามที่ได้แจ้งนัดหมายไว้
นายเศรษฐา กล่าวว่า โครงการดิจิทัลวอลเล็ต ไม่ใช่แค่ความฝัน แต่กำลังเป็นความจริง รัฐบาลได้หาข้อสรุปที่ดีที่สุดในการกระตุ้นและสร้างความมั่นคงทางเศรษฐกิจ ผ่านการเติมเงินลงไปในระบบเศรษฐกิจ มูลค่า 6 แสนล้านบาท ซึ่งจะอยู่ในโครงการดิจิทัลวอลเล็ต 5 แสนล้านบาท ครอบคลุม 50 ล้านคน และอีก 1 แสนล้านบาท ในกองทุนเพิ่มขีดความสามารถ และทุกอย่างที่แถลงในวันนี้จะยังต้องผ่านกระบวนการตามกฎหมาย และต้องมีมติของคณะกรรมการที่เกี่ยวข้อง ก่อนจะสรุปอีกครั้ง"
